{
  "schema_version": 3,
  "game_name": "Rogue Legacy",
  "archipelago_version": "0.6.1",
  "generation_seed": 1,
  "player_names": {
    "1": "Player1"
  },
  "world_classes": {
    "1": "RLWorld"
  },
  "plando_options": [
    "connections",
    "texts",
    "bosses"
  ],
  "regions": {
    "1": {
      "Menu": {
        "name": "Menu",
        "type": "Region",
        "player": 1,
        "entrances": [],
        "exits": [
          {
            "name": "Castle Hamson",
            "connected_region": "Castle Hamson",
            "access_rule": {
              "type": "constant",
              "value": true
            },
            "type": "Exit"
          }
        ],
        "locations": [],
        "time_passes": true,
        "provides_chest_count": true,
        "region_rules": []
      },
      "The Manor": {
        "name": "The Manor",
        "type": "Region",
        "player": 1,
        "entrances": [
          {
            "name": "The Manor",
            "parent_region": "Castle Hamson",
            "connected_region": "The Manor",
            "reverse": null,
            "assumed": false,
            "type": "Entrance"
          }
        ],
        "exits": [],
        "locations": [
          {
            "name": "Manor - Ground Road",
            "id": 91000,
            "crystal": null,
            "access_rule": {
              "type": "constant",
              "value": true
            },
            "progress_type": 1,
            "locked": false,
            "item": {
              "name": "Armor Up",
              "player": 1,
              "advancement": false,
              "priority": null,
              "type": "None"
            }
          },
          {
            "name": "Manor - Main Base",
            "id": 91001,
            "crystal": null,
            "access_rule": {
              "type": "constant",
              "value": true
            },
            "progress_type": 1,
            "locked": false,
            "item": {
              "name": "Crit Damage Up",
              "player": 1,
              "advancement": false,
              "priority": null,
              "type": "None"
            }
          },
          {
            "name": "Manor - Main Bottom Window",
            "id": 91002,
            "crystal": null,
            "access_rule": {
              "type": "constant",
              "value": true
            },
            "progress_type": 1,
            "locked": false,
            "item": {
              "name": "Attack Up",
              "player": 1,
              "advancement": true,
              "priority": null,
              "type": "None"
            }
          },
          {
            "name": "Manor - Main Top Window",
            "id": 91003,
            "crystal": null,
            "access_rule": {
              "type": "constant",
              "value": true
            },
            "progress_type": 1,
            "locked": false,
            "item": {
              "name": "Curse Runes",
              "player": 1,
              "advancement": false,
              "priority": null,
              "type": "None"
            }
          },
          {
            "name": "Manor - Main Rooftop",
            "id": 91004,
            "crystal": null,
            "access_rule": {
              "type": "constant",
              "value": true
            },
            "progress_type": 1,
            "locked": false,
            "item": {
              "name": "Sky Blueprints",
              "player": 1,
              "advancement": false,
              "priority": null,
              "type": "None"
            }
          },
          {
            "name": "Manor - Left Wing Base",
            "id": 91005,
            "crystal": null,
            "access_rule": {
              "type": "constant",
              "value": true
            },
            "progress_type": 1,
            "locked": false,
            "item": {
              "name": "Crit Damage Up",
              "player": 1,
              "advancement": false,
              "priority": null,
              "type": "None"
            }
          },
          {
            "name": "Manor - Left Wing Window",
            "id": 91006,
            "crystal": null,
            "access_rule": {
              "type": "item_check",
              "item": {
                "type": "name",
                "name": "event"
              }
            },
            "progress_type": 1,
            "locked": false,
            "item": {
              "name": "Attack Up",
              "player": 1,
              "advancement": true,
              "priority": null,
              "type": "None"
            }
          },
          {
            "name": "Manor - Left Wing Rooftop",
            "id": 91007,
            "crystal": null,
            "access_rule": {
              "type": "item_check",
              "item": {
                "type": "name",
                "name": "event"
              }
            },
            "progress_type": 1,
            "locked": false,
            "item": {
              "name": "Dragon Blueprints",
              "player": 1,
              "advancement": false,
              "priority": null,
              "type": "None"
            }
          },
          {
            "name": "Manor - Left Big Base",
            "id": 91008,
            "crystal": null,
            "access_rule": {
              "type": "item_check",
              "item": {
                "type": "name",
                "name": "event"
              }
            },
            "progress_type": 1,
            "locked": false,
            "item": {
              "name": "Magic Damage Up",
              "player": 1,
              "advancement": true,
              "priority": null,
              "type": "None"
            }
          },
          {
            "name": "Manor - Left Big Upper 1",
            "id": 91009,
            "crystal": null,
            "access_rule": {
              "type": "item_check",
              "item": {
                "type": "name",
                "name": "event"
              }
            },
            "progress_type": 1,
            "locked": false,
            "item": {
              "name": "Armor Up",
              "player": 1,
              "advancement": false,
              "priority": null,
              "type": "None"
            }
          },
          {
            "name": "Manor - Left Big Upper 2",
            "id": 91010,
            "crystal": null,
            "access_rule": {
              "type": "item_check",
              "item": {
                "type": "name",
                "name": "event"
              }
            },
            "progress_type": 1,
            "locked": false,
            "item": {
              "name": "Attack Up",
              "player": 1,
              "advancement": true,
              "priority": null,
              "type": "None"
            }
          },
          {
            "name": "Manor - Left Big Windows",
            "id": 91011,
            "crystal": null,
            "access_rule": {
              "type": "item_check",
              "item": {
                "type": "name",
                "name": "event"
              }
            },
            "progress_type": 1,
            "locked": false,
            "item": {
              "name": "Health Up",
              "player": 1,
              "advancement": true,
              "priority": null,
              "type": "None"
            }
          },
          {
            "name": "Manor - Left Big Rooftop",
            "id": 91012,
            "crystal": null,
            "access_rule": {
              "type": "item_check",
              "item": {
                "type": "name",
                "name": "event"
              }
            },
            "progress_type": 1,
            "locked": false,
            "item": {
              "name": "Health Up",
              "player": 1,
              "advancement": true,
              "priority": null,
              "type": "None"
            }
          },
          {
            "name": "Manor - Left Far Base",
            "id": 91013,
            "crystal": null,
            "access_rule": {
              "type": "item_check",
              "item": {
                "type": "name",
                "name": "event"
              }
            },
            "progress_type": 1,
            "locked": false,
            "item": {
              "name": "Haste Runes",
              "player": 1,
              "advancement": false,
              "priority": null,
              "type": "None"
            }
          },
          {
            "name": "Manor - Left Far Roof",
            "id": 91014,
            "crystal": null,
            "access_rule": {
              "type": "item_check",
              "item": {
                "type": "name",
                "name": "event"
              }
            },
            "progress_type": 1,
            "locked": false,
            "item": {
              "name": "Mana Up",
              "player": 1,
              "advancement": true,
              "priority": null,
              "type": "None"
            }
          },
          {
            "name": "Manor - Left Extension",
            "id": 91015,
            "crystal": null,
            "access_rule": {
              "type": "item_check",
              "item": {
                "type": "name",
                "name": "event"
              }
            },
            "progress_type": 1,
            "locked": false,
            "item": {
              "name": "Potion Efficiency Up",
              "player": 1,
              "advancement": false,
              "priority": null,
              "type": "None"
            }
          },
          {
            "name": "Manor - Left Tree 1",
            "id": 91016,
            "crystal": null,
            "access_rule": {